{"adapter":"codex","available_budget":{"cost_microunits":{"status":"known","value":1000},"duration_ms":{"status":"known","value":1000},"token_count":{"status":"known","value":1000}},"capabilities":["repository.read"],"context_digest":"sha256:f00bbf810675bc00daf34930a609519aba1816cd04326f98a5d71279323f8167","current_state_refs":[],"domain":"software-engineering","model":"gpt-5.6-sol","object_kind":"portfolio_selection_context","operation_scopes":["local_repository"],"portfolio_lock_digest":"sha256:3f25ba2955ccc1562fd1611da035c81eaef5eab85998ce43f65e99c8e463428c","project_id":"github.com/ist-h-i/agent-spectrum-kernel","repository_id":"github.com/ist-h-i/agent-spectrum-kernel","risk_class":"normal","schema_version":"1.0.0","selection_phase":"pre_result","source_revision":"58b21338c0378a2f8ea8e955979eaa5041ac098e","stack":"node","task_class":"implementation","tree_digest":"sha256:cba765f764e2ccfef249d00bb85771f0282ab2c873c2fa63a86e3f351cc1b087"}
