{"adapter":"codex","available_budget":{"cost_microunits":{"status":"known","value":1000000},"duration_ms":{"status":"known","value":900000},"token_count":{"status":"known","value":100000}},"capabilities":["local_filesystem"],"context_digest":"sha256:7d0b8ddb780dafa2f077cbedbafcda611318dc1938f9b9a9486596f6a11db123","current_state_refs":[{"state_digest":"sha256:fd30267aad90ab533950fd223faf4422e09bb0cf36ff4278e6b3c5561856c2e9","state_id":"repository-tree"}],"domain":"ai-engineering","model":"gpt-5.6-sol","object_kind":"portfolio_selection_context","operation_scopes":["local_repository"],"portfolio_lock_digest":"sha256:c12f13a5762d3a0c1e6868fca76e43197c541f2ac61965cf6fdc58714079f633","project_id":"github.com/ist-h-i/agent-spectrum-kernel","repository_id":"github.com/ist-h-i/agent-spectrum-kernel","risk_class":"ordinary","schema_version":"1.0.0","selection_phase":"pre_result","source_revision":"9586ea62888c896e6bda7e5647972218fe96ea0d","stack":"node","task_class":"implementation","tree_digest":"sha256:fd30267aad90ab533950fd223faf4422e09bb0cf36ff4278e6b3c5561856c2e9"}
