{"adapter":"codex","available_budget":{"cost_microunits":{"status":"known","value":1000000},"duration_ms":{"status":"known","value":900000},"token_count":{"status":"known","value":100000}},"capabilities":["prompt_v2_exact_projection"],"context_digest":"sha256:224a2613f5cc7ff614f172ab5b6df71a25005eb1e384b657f65fb28190ee69c1","current_state_refs":[{"state_digest":"sha256:8b7fadc5afd29fdb22520861dadbf948feee09feb90404bdba389e2957db1737","state_id":"repository-tree"}],"domain":"ai_engineering","model":"gpt-5.6-sol","object_kind":"portfolio_selection_context","operation_scopes":["prompt_v2_preregistration"],"portfolio_lock_digest":"sha256:b2ae7e7ac41f9e2c3b76e57f41a2e424b6702a67a6148eec8c02a8c39b77a7d4","project_id":"github.com/ist-h-i/agent-spectrum-kernel","repository_id":"github.com/ist-h-i/agent-spectrum-kernel","risk_class":"ordinary","schema_version":"1.0.0","selection_phase":"pre_result","source_revision":"1710b3007d60e249d553ca7a43b5a83937066b61","stack":"prompt_v2_preregistration","task_class":"verification","tree_digest":"sha256:8b7fadc5afd29fdb22520861dadbf948feee09feb90404bdba389e2957db1737"}
