{"adapter":"codex","available_budget":{"cost_microunits":{"status":"known","value":1000000},"duration_ms":{"status":"known","value":900000},"token_count":{"status":"known","value":100000}},"capabilities":["local_filesystem"],"context_digest":"sha256:47da45c426da14c73525232f7cc09667a65bf8cfea01aa05bb8b534831767119","current_state_refs":[{"state_digest":"sha256:d824bcfe6b2a8054316617de4606450be963903d9e645afc4886e6088d7d253c","state_id":"repository-tree"}],"domain":"ai-engineering","model":"gpt-5.6-sol","object_kind":"portfolio_selection_context","operation_scopes":["local_repository"],"portfolio_lock_digest":"sha256:83e406f149b89e8ed14c16c5aa51b610ad1f85e24c09653e720b0da09144b033","project_id":"github.com/ist-h-i/agent-spectrum-kernel","repository_id":"github.com/ist-h-i/agent-spectrum-kernel","risk_class":"ordinary","schema_version":"1.0.0","selection_phase":"pre_result","source_revision":"c24f459b0bf69a755dfde00719516e4a5844018d","stack":"node","task_class":"implementation","tree_digest":"sha256:d824bcfe6b2a8054316617de4606450be963903d9e645afc4886e6088d7d253c"}
