{"adapter":"claude_code","available_budget":{"cost_microunits":{"status":"known","value":1000000},"duration_ms":{"status":"known","value":900000},"token_count":{"status":"known","value":100000}},"capabilities":["prompt_v2_exact_projection"],"context_digest":"sha256:b6054bdf29ce6f27e098c7b9c0ed8810cf1ca2958fe6c234d5d8ddb2261b92ba","current_state_refs":[{"state_digest":"sha256:8b7fadc5afd29fdb22520861dadbf948feee09feb90404bdba389e2957db1737","state_id":"repository-tree"}],"domain":"ai_engineering","model":"unavailable","object_kind":"portfolio_selection_context","operation_scopes":["prompt_v2_preregistration"],"portfolio_lock_digest":"sha256:1c70bc7146f6630c9c3734d1607f3b0c3c47edc834d5274b33e47efbccf21d0c","project_id":"github.com/ist-h-i/agent-spectrum-kernel","repository_id":"github.com/ist-h-i/agent-spectrum-kernel","risk_class":"ordinary","schema_version":"1.0.0","selection_phase":"pre_result","source_revision":"1710b3007d60e249d553ca7a43b5a83937066b61","stack":"prompt_v2_preregistration","task_class":"verification","tree_digest":"sha256:8b7fadc5afd29fdb22520861dadbf948feee09feb90404bdba389e2957db1737"}
