{"adapter":"claude_code","available_budget":{"cost_microunits":{"status":"known","value":1000000},"duration_ms":{"status":"known","value":900000},"token_count":{"status":"known","value":100000}},"capabilities":["prompt_v2_exact_projection"],"context_digest":"sha256:b9650d19453fbcbf93c10d64c09d82b1c3a107c1ec469210365c696234657164","current_state_refs":[{"state_digest":"sha256:ebef1b35363d8097b303fb4d6937b573e2efccc342176adca3ce9c3ff3e95b35","state_id":"repository-tree"}],"domain":"ai_engineering","model":"unavailable","object_kind":"portfolio_selection_context","operation_scopes":["prompt_v2_preregistration"],"portfolio_lock_digest":"sha256:95daef2bee6315f815c5fdd9137c72eb87666faa27659cd3dd069fb0f1bdd47c","project_id":"github.com/ist-h-i/agent-spectrum-kernel","repository_id":"github.com/ist-h-i/agent-spectrum-kernel","risk_class":"ordinary","schema_version":"1.0.0","selection_phase":"pre_result","source_revision":"c508a767f3386dac10180770edf37a67806fbb1b","stack":"prompt_v2_preregistration","task_class":"verification","tree_digest":"sha256:ebef1b35363d8097b303fb4d6937b573e2efccc342176adca3ce9c3ff3e95b35"}
